Sany Heavy Equipment International Holdings Company Limited (SEHK:631),4994667,SEHK,Industrials; Capital Goods; Construction Machinery and Heavy Transportation Equipment; Heavy Duty Trucks; Industrial Trucks and Trailers; Machinery; Dump Truck Lifting Mechanisms,2.35,2.07,1.99,1.87,2.52,"16,282.57",16.99,13.57,14.02,15.73,17.67,16.99,34.93,37.70,35.80,28.00,NA,2.64,4.26,61.36,4.46,5.80,30.04,5.87,7.54,28.45,7.79,8.02,2.95,8.00,7.55,(5.63),,,,2.35,61.36,,34.93,61.36
Shandong Weigao Group Medical Polymer Company Limited (SEHK:1066),4812322,SEHK,Health Care; Health Care Equipment and Services; Health Care Equipment and Supplies; Health Care Supplies; Medical Consumables,1.34,0.79,1.80,1.35,2.19,"22,030.45",8.69,11.96,12.31,12.31,13.01,8.69,38.46,33.61,28.70,27.23,NA,6.06,9.34,54.13,9.16,17.52,91.27,17.00,9.73,(42.76),9.91,12.82,29.36,13.04,7.61,(41.64),,,,1.34,54.13,,38.46,54.13
Shandong Xinhua Pharmaceutical Company Limited (SEHK:719),4810873,SEHK,"Health Care; Pharmaceuticals, Biotechnology and Life Sciences; Pharmaceuticals; Pharmaceuticals; Medicinal Chemicals and Botanical Products; Pharmaceutical Products; Anti-infective Drugs; Cardiovascular Drugs; Central Nervous System Drugs",2.98,3.70,3.87,2.16,3.79,"8,939.36",11.09,10.91,10.68,10.28,10.65,11.09,38.80,39.05,42.59,39.66,35.43,3.61,3.82,5.82,3.88,3.55,(8.51),3.52,4.65,32.10,4.57,8.15,78.34,8.38,5.78,(31.03),,,,2.98,5.82,,38.80,5.82
"Shanghai Fudan-Zhangjiang Bio-Pharmaceutical Co.,Ltd. (SEHK:1349)",4811405,SEHK,"Health Care; Pharmaceuticals, Biotechnology and Life Sciences; Pharmaceuticals; Pharmaceuticals; Pharmaceutical Products; Cardiovascular Drugs; Anti-infective Drugs; Oncology Drugs",1.83,2.03,1.59,2.48,3.13,"5,842.77",4.70,23.38,11.17,10.12,6.18,4.70,30.88,42.37,24.45,51.48,70.10,3.96,4.46,12.63,4.48,3.81,(14.96),3.89,3.85,(1.03),3.91,3.47,(11.25),3.50,2.55,(27.14),,,,1.83,12.63,,30.88,12.63
"Shanghai Haohai Biological Technology Co., Ltd. (SEHK:6826)",4811438,SEHK,"Health Care; Pharmaceuticals, Biotechnology and Life Sciences; Biotechnology; Biotechnology",1.24,1.64,1.18,2.23,1.09,"14,911.70",6.92,7.93,3.98,5.89,3.18,6.92,21.58,53.92,24.96,70.31,17.69,38.30,47.10,22.98,46.85,46.80,(0.11),48.15,51.50,6.96,52.00,36.85,(29.13),36.35,40.30,10.87,,,,1.24,22.98,,21.58,22.98
Shanghai Industrial Holdings Limited (SEHK:363),6333815,SEHK,Industrials; Capital Goods; Industrial Conglomerates; Industrial Conglomerates,6.67,4.53,8.80,9.95,9.49,"11,415.72",5.87,7.50,5.07,5.03,4.21,5.87,16.88,36.26,29.03,45.11,NA,15.30,15.00,(1.96),15.12,10.60,(29.89),10.68,11.36,6.37,11.36,9.65,(15.05),9.94,9.69,(2.52),,,,6.67,-1.96,,16.88,-1.96
Shenzhen Expressway Corporation Limited (SEHK:548),4995088,SEHK,Industrials; Transportation; Transportation Infrastructure; Highways and Railtracks,3.67,7.79,6.87,10.79,8.28,"21,390.73",8.62,12.86,9.45,9.71,6.64,8.62,85.11,87.28,95.19,130.40,105.14,8.54,11.18,30.91,11.52,7.30,(36.63),7.29,7.55,3.57,7.64,6.73,(11.91),6.86,6.31,(8.02),,,,3.67,30.91,,85.11,30.91
Shenzhen International Holdings Limited (SEHK:152),4995063,SEHK,Industrials; Transportation; Transportation Infrastructure; Highways and Railtracks,2.10,4.23,1.51,1.63,3.91,"14,215.30",5.27,15.51,11.41,9.88,3.15,5.27,39.21,82.02,15.19,54.20,NA,14.94,17.12,14.59,17.20,12.52,(27.21),12.42,8.10,(34.78),8.22,7.66,(6.81),7.66,6.58,(14.10),,,,2.10,14.59,,39.21,14.59
Shenzhen Investment Limited (SEHK:604),4143421,SEHK,Real Estate; Real Estate Management and Development; Diversified Real Estate Activities; Real Estate Management and Development,5.77,6.77,10.71,8.21,12.17,"8,275.88",0.40,9.33,7.64,(3.83),4.73,0.40,37.87,42.83,NM,64.02,NM,2.52,3.12,23.81,3.16,2.66,(15.82),2.64,1.68,(36.36),1.67,1.34,(19.76),1.37,1.15,(16.06),,,,5.77,23.81,,37.87,23.81
Shenzhou International Group Holdings Limited (SEHK:2313),4914521,SEHK,"Consumer Discretionary; Consumer Durables and Apparel; Textiles, Apparel and Luxury Goods; Apparel, Accessories and Luxury Goods; Apparel",1.58,1.25,1.44,1.86,2.24,"103,797.51",14.32,20.81,19.38,12.25,15.59,14.32,47.16,50.57,80.60,45.22,NA,86.80,113.90,31.22,114.70,152.00,32.52,150.40,149.90,(0.33),138.20,87.80,(36.47),88.65,80.40,(9.31),,,,1.58,31.22,,47.16,31.22
Shoucheng Holdings Limited (SEHK:697),4491799,SEHK,Real Estate; Real Estate Management and Development; Real Estate Management and Development; Diversified Real Estate Activities,5.21,5.25,6.19,5.06,212.36,"10,000.67",4.58,4.69,5.85,(10.06),9.03,4.58,26.10,121.49,NM,95.22,NA,0.96,1.93,100.52,1.93,2.20,14.29,2.16,1.55,(28.24),1.56,1.90,21.79,1.91,1.57,(17.80),,,,5.21,100.52,,26.10,100.52
Shougang Fushan Resources Group Limited (SEHK:639),4354182,SEHK,Materials; Materials; Metals and Mining; Steel; Metallurgical (Coking) Coal Mining,10.12,8.90,6.44,18.88,13.19,"14,681.98",12.39,6.96,6.92,16.80,17.49,12.39,77.63,79.68,33.83,88.13,NA,1.55,1.68,8.39,1.70,1.82,7.06,1.85,2.64,42.70,2.32,2.49,7.33,2.52,2.88,14.29,,,,10.12,8.39,,77.63,8.39
Sichuan Expressway Company Limited (SEHK:107),4995058,SEHK,Industrials; Transportation; Transportation Infrastructure; Highways and Railtracks,4.66,6.65,4.64,7.08,4.56,"15,930.70",6.59,7.28,4.47,11.13,3.37,6.59,101.49,160.26,55.93,266.03,141.02,2.38,2.44,2.52,2.45,1.80,(26.53),1.82,2.08,14.29,2.07,1.82,(12.08),1.84,2.44,32.61,,,,4.66,2.52,,101.49,2.52
Sino Biopharmaceutical Limited (SEHK:1177),4811882,SEHK,"Health Care; Pharmaceuticals, Biotechnology and Life Sciences; Pharmaceuticals; Pharmaceuticals; Pharmaceutical Products; Cardiovascular Drugs; Oncology Drugs; Respiratory Drugs; Medicinal Chemicals and Botanical Products; Pharmaceutical Research and Development",0.73,0.89,1.83,2.48,2.31,"46,589.00",12.12,16.48,20.20,55.25,13.22,12.12,29.68,42.84,6.42,49.84,NA,3.31,7.27,119.32,7.33,7.50,2.27,7.70,5.46,(29.09),5.62,4.57,(18.68),4.63,3.47,(25.05),,,,0.73,119.32,,29.68,119.32
Sino Land Company Limited (SEHK:83),4143454,SEHK,Real Estate; Real Estate Management and Development; Real Estate Development; Real Estate Management and Development,4.86,5.45,5.66,5.84,6.83,"65,606.88",3.66,4.89,1.15,6.92,3.79,3.66,53.32,225.32,62.11,74.97,78.70,13.16,11.32,(13.98),11.40,10.10,(11.40),10.20,9.71,(4.80),9.66,9.76,1.04,10.12,8.49,(16.11),,,,4.86,-13.98,,53.32,-13.98
Sinofert Holdings Limited (SEHK:297),4354297,SEHK,Materials; Materials; Chemicals; Fertilizers and Agricultural Chemicals; Nitrogenous Fertilizers; Phosphatic Fertilizers,2.77,3.87,2.79,5.56,6.85,"5,619.56",6.96,8.62,8.24,10.27,12.02,6.96,23.24,30.22,22.45,28.81,NA,0.87,0.81,(6.90),0.82,0.76,(7.32),0.76,1.17,53.95,1.25,0.95,(24.00),0.95,0.91,(4.21),,,,2.77,-6.90,,23.24,-6.90
"SINOPEC Engineering (Group) Co., Ltd. (SEHK:2386)",4990128,SEHK,"Industrials; Capital Goods; Construction and Engineering; Construction and Engineering; Construction Support Services; Heavy Construction; Commercial Construction and Engineering; Commercial Construction, General Contractors and Operative Builders; Commercial and Institutional Buildings; Industrial Buildings and Warehouses; Construction Management Services; Engineering and Surveying Services; Engineering Services; Nonbuilding Structures Construction",5.56,11.32,8.80,11.57,9.08,"20,991.40",7.67,8.20,8.58,7.42,7.73,7.67,47.05,58.06,55.77,64.09,60.77,6.53,4.66,(28.64),4.80,3.34,(30.42),3.46,3.85,11.27,3.84,3.43,(10.68),3.52,4.00,13.64,,,,5.56,-28.64,,47.05,-28.64
Sinopec Kantons Holdings Limited (SEHK:934),4980643,SEHK,"Energy; Energy; Oil, Gas and Consumable Fuels; Oil and Gas Storage and Transportation",5.49,7.41,6.54,6.78,6.55,"9,397.68",8.55,9.08,9.41,6.97,2.66,8.55,34.82,21.60,47.34,114.34,NA,3.34,3.28,(1.80),3.29,2.70,(17.93),2.82,3.06,8.51,3.08,2.95,(4.22),2.88,3.36,16.67,,,,5.49,-1.80,,34.82,-1.80
Sinopharm Group Co. Ltd. (SEHK:1099),4811392,SEHK,Health Care; Healthcare Equipment Distribution; Health Care Equipment and Services; Health Care Providers and Services; Health Care Distributors; Pharmaceutical Product Distribution,2.36,3.46,4.95,4.40,4.41,"60,977.62",13.03,14.63,14.50,13.78,13.68,13.03,28.04,25.95,27.75,27.45,NA,31.05,28.45,(8.37),28.35,18.86,(33.47),18.98,16.96,(10.64),17.40,19.84,14.02,20.35,20.45,0.49,,,,2.36,-8.37,,28.04,-8.37
Sinotrans Limited (SEHK:598),4241666,SEHK,Industrials; Transportation; Air Freight and Logistics; Air Freight and Logistics; Charter Freight Air Transportation; Services Incidental to Road Transportation of Freight; Freight Loading and Unloading; Freight Packing and Crating,5.75,4.67,5.71,8.89,8.25,"45,203.44",11.56,10.08,9.19,11.69,11.88,11.56,36.40,32.27,23.92,51.00,42.02,3.33,2.65,(20.42),2.71,2.82,4.06,2.86,2.50,(12.59),2.54,2.54,0.00,2.56,3.27,27.73,,,,5.75,-20.42,,36.40,-20.42
Sinotruk (Hong Kong) Limited (SEHK:3808),4994628,SEHK,Industrials; Capital Goods; Machinery; Construction Machinery and Heavy Transportation Equipment; Heavy Duty Trucks; Construction Machinery and Equipment; Truck Bodies,3.85,1.97,8.67,6.25,2.15,"59,637.46",12.82,13.54,22.77,12.01,4.78,12.82,44.75,14.47,55.83,86.60,NA,11.16,16.62,48.92,16.68,19.80,18.71,19.38,12.00,(38.08),11.90,10.88,(8.57),11.18,15.32,37.03,,,,3.85,48.92,,44.75,48.92
SITC International Holdings Company Limited (SEHK:1308),4539927,SEHK,Industrials; Transportation; Marine Transportation; Marine Transportation; Marine Transportation Of Freight; Cargo or Container Ships,4.63,2.93,5.67,21.89,16.32,"40,668.72",26.18,21.45,31.94,86.11,105.95,26.18,68.14,77.40,47.47,80.95,141.51,7.00,9.50,35.71,9.60,16.74,74.38,18.00,28.20,56.67,29.65,17.36,(41.45),17.48,13.48,(22.88),,,,4.63,35.71,,68.14,35.71
SSY Group Limited (SEHK:2005),4812016,SEHK,"Health Care; Pharmaceuticals, Biotechnology and Life Sciences; Pharmaceuticals; Pharmaceuticals; Medicinal Chemicals and Botanical Products; Pharmaceutical Products",1.58,2.50,2.49,3.02,3.04,"13,657.60",19.25,23.78,11.00,12.71,18.25,19.25,26.62,54.39,38.52,34.57,NA,5.56,6.31,13.49,6.45,4.40,(31.78),4.50,4.02,(10.67),4.02,4.31,7.21,4.90,4.94,0.82,,,,1.58,13.49,,26.62,13.49
Sun Art Retail Group Limited (SEHK:6808),4911901,SEHK,Consumer Staples; Consumer Staples Distribution and Retail; Consumer Staples Distribution and Retail; Consumer Staples Merchandise Retail; Hypermarkets and Super Centers,1.48,1.90,4.15,1.76,3.21,"13,737.17",0.32,12.43,11.60,NA,(3.12),0.32,40.68,NA,36.67,NM,345.87,7.70,9.45,22.73,9.40,7.88,(16.17),7.90,3.13,(60.38),3.13,2.56,(18.21),2.74,1.40,(48.91),,,,1.48,22.73,,40.68,22.73
Sun Hung Kai Properties Limited (SEHK:16),4143426,SEHK,Real Estate; Real Estate Management and Development; Diversified Real Estate Activities; Real Estate Management and Development,4.15,4.95,5.23,4.63,5.86,"201,540.62",4.05,8.19,4.17,4.61,4.33,4.05,31.94,60.96,53.75,56.12,60.00,108.80,119.30,9.65,118.50,100.00,(15.61),103.30,94.60,(8.42),94.55,106.80,12.96,109.20,84.45,(22.66),,,,4.15,9.65,,31.94,9.65
SUNeVision Holdings Ltd. (SEHK:1686),4967253,SEHK,Information Technology; Software and Services; Co-location/Data Centers; IT Services; Infrastructure Services; Internet Services and Infrastructure,3.13,2.48,2.63,4.93,3.62,"9,660.60",19.58,15.47,16.31,17.95,18.73,19.58,70.60,85.29,90.08,92.97,93.25,4.60,5.27,14.57,5.25,7.05,34.29,7.28,7.38,1.37,7.28,4.22,(42.03),4.26,3.09,(27.46),,,,3.13,14.57,,70.60,14.57
Sunny Optical Technology (Group) Company Limited (SEHK:2382),4971046,SEHK,"Information Technology; Technology Hardware and Equipment; Electronic Equipment, Instruments and Components; Electronic Components; Electronic Components; Optoelectronics",0.49,0.48,0.43,1.20,0.71,"40,480.42",5.11,36.52,33.43,26.81,11.49,5.11,15.56,16.35,19.79,43.97,NA,65.85,134.90,104.86,139.00,169.70,22.09,177.00,246.60,39.32,250.00,92.85,(62.86),95.90,70.85,(26.12),,,,0.49,104.86,,15.56,104.86
Swire Pacific Limited (SEHK:19),4210824,SEHK,Real Estate; Real Estate Management and Development; Diversified Real Estate Activities; Real Estate Management and Development,4.35,5.47,4.51,4.00,4.61,"78,856.96",9.31,3.62,(1.56),2.09,1.85,9.31,41.67,NM,96.65,89.02,47.27,79.85,72.40,(9.33),72.90,43.00,(41.02),44.45,44.35,(0.22),44.90,68.70,53.01,66.70,66.10,(0.90),,,,4.35,-9.33,,41.67,-9.33
Swire Properties Limited (SEHK:1972),4253046,SEHK,Real Estate; Real Estate Management and Development; Real Estate Operating Companies; Real Estate Operators And Lessors; Nonresidential Building Operators and Lessors; Real Estate Management and Development; Real Estate Management Services; Nonresidential Property Managers; Residential Property Managers; Residential Building Operators and Lessors,3.33,3.95,4.71,4.84,6.39,"87,048.00",0.95,4.72,1.40,2.49,2.81,0.95,38.43,130.00,77.87,73.53,233.33,27.25,25.85,(5.14),25.70,22.55,(12.26),23.30,19.54,(16.14),20.20,19.84,(1.78),20.65,15.80,(23.49),,,,3.33,-5.14,,38.43,-5.14
Techtronic Industries Company Limited (SEHK:669),4911120,SEHK,Industrials; Capital Goods; Machinery; Industrial Machinery and Supplies and Components,1.49,1.00,1.08,2.24,1.99,"191,164.06",17.83,19.07,21.95,25.49,21.70,17.83,36.36,32.67,35.86,42.74,44.74,41.10,63.55,54.62,64.75,110.60,70.81,114.30,155.20,35.78,157.60,87.10,(44.73),88.35,93.05,5.32,,,,1.49,54.62,,36.36,54.62
Tencent Holdings Limited (SEHK:700),4329847,SEHK,Media and Entertainment; Online Services; Social Media and Networking Platforms; Communication Services; Interactive Media and Services; Interactive Media and Services,0.27,0.21,0.35,0.48,0.82,"2,808,882.33",14.25,22.70,25.28,27.53,22.74,14.25,8.91,6.47,5.56,6.88,18.21,306.60,375.60,22.50,382.40,564.00,47.49,572.50,456.80,(20.21),453.80,334.00,(26.40),345.20,293.60,(14.95),,,,0.27,22.50,,8.91,22.50
"The Bank of East Asia, Limited (SEHK:23)",4073180,SEHK,Financials; Banks; Banks; Diversified Banks; Diversified Commercial Banks,2.47,3.08,5.27,5.39,5.50,"24,279.26",3.85,3.13,3.30,4.62,3.94,3.85,51.44,41.29,45.82,61.21,40.91,24.60,17.40,(29.27),17.74,16.56,(6.65),16.64,11.20,(32.69),11.30,9.46,(16.28),9.50,9.64,1.47,,,,2.47,-29.27,,51.44,-29.27
The Hong Kong and China Gas Company Limited (SEHK:3),4157456,SEHK,Utilities; Utilities; Gas Utilities; Gas Utilities; Oil and Gas Distribution,2.17,2.93,2.79,4.72,5.85,"105,988.06",9.81,11.15,9.33,7.73,8.06,9.81,78.85,98.49,123.38,121.86,NA,13.41,13.80,2.96,13.84,11.03,(20.32),11.14,12.14,8.95,12.28,7.42,(39.58),7.53,5.98,(20.58),,,,2.17,2.96,,78.85,2.96
The United Laboratories International Holdings Limited (SEHK:3933),4810869,SEHK,"Health Care; Pharmaceuticals, Biotechnology and Life Sciences; Pharmaceuticals; Pharmaceuticals; Medicinal Chemicals and Botanical Products; Pharmaceutical Products; Anti-infective Drugs; Cardiovascular Drugs; Oncology Drugs; Antibiotics; Antiviral Drugs; Central Nervous System Drugs; Vaccines; Veterinary Drugs",1.20,1.39,2.22,3.06,4.05,"17,552.48",23.13,10.03,9.17,11.03,15.85,23.13,15.33,18.23,22.35,17.24,NA,4.05,5.68,40.25,5.62,5.50,(2.14),5.34,4.36,(18.35),4.57,4.90,7.22,5.14,7.01,36.38,,,,1.20,40.25,,15.33,40.25
The Wharf (Holdings) Limited (SEHK:4),4210707,SEHK,Real Estate; Diversified Real Estate Activities; Real Estate Management and Development; Real Estate Management and Development,3.28,1.32,1.67,1.74,1.59,"75,789.48",0.73,2.43,3.09,3.84,(0.89),0.73,29.28,31.50,20.30,NA,NA,19.98,19.82,(0.80),19.98,20.85,4.35,20.15,23.95,18.86,23.55,22.95,(2.55),23.15,25.15,8.64,,,,3.28,-0.80,,29.28,-0.80
Tian An China Investments Company Limited (SEHK:28),4147698,SEHK,"Real Estate; Real Estate Management and Development; Real Estate Development; Land Sub Dividers And Developers; Real Estate Management and Development; Land Sub Dividers and Developers, except Cemetery",5.76,4.32,4.63,5.05,7.10,"5,805.64",4.64,5.33,2.16,5.06,5.57,4.64,22.39,48.56,20.98,19.18,NA,4.09,3.47,(15.16),3.48,4.63,33.05,4.64,4.32,(6.90),4.30,3.96,(7.91),3.94,3.52,(10.66),,,,5.76,-15.16,,22.39,-15.16
Tianli International Holdings Limited (SEHK:1773),10797280,SEHK,Consumer Discretionary; Consumer Services; Diversified Consumer Services; Education Services; Schools; Elementary and Secondary Schools; Specialty Educational Services; Child Day Care Services; Exam Preparation and Tutoring,1.05,0.50,4.03,1.23,1.65,"8,633.32",16.66,11.29,0.39,NA,5.25,16.66,22.39,20.50,NM,85.03,30.45,1.40,3.10,121.43,3.10,8.16,163.23,8.51,1.91,(77.56),1.91,2.02,5.76,2.63,3.23,22.81,,,,1.05,121.43,,22.39,121.43
Tianneng Power International Limited (SEHK:819),4912383,SEHK,Consumer Discretionary; Automobiles and Components; Automobile Components; Automotive Parts and Equipment,6.41,2.09,4.85,4.85,6.07,"6,925.67",10.31,27.23,29.91,12.49,12.78,10.31,22.37,16.32,28.83,15.70,27.98,6.59,5.93,(10.02),6.16,18.70,203.57,19.58,8.25,(57.87),8.23,8.24,0.12,8.57,6.59,(23.10),,,,6.41,-10.02,,22.37,-10.02
Tingyi (Cayman Islands) Holding Corp. (SEHK:322),4298555,SEHK,"Consumer Staples; Food, Beverage and Tobacco; Coffee And Tea; Coffee; Tea; Meats, Meat Processing And Meat Related Products; Meat Products; Snack Food; Food Products; Packaged Foods and Meats; Bread and Bakery Products; Prepared and Preserved Foods",1.89,2.48,5.36,3.02,2.70,"46,765.16",20.66,15.94,19.14,18.60,15.68,20.66,37.63,41.00,53.42,77.92,NA,10.24,13.30,29.88,13.22,13.24,0.15,13.22,16.02,21.18,15.80,13.78,(12.78),14.02,9.52,(32.10),,,,1.89,29.88,,37.63,29.88
Tong Ren Tang Technologies Co. Ltd. (SEHK:1666),4280194,SEHK,"Health Care; Pharmaceuticals, Biotechnology and Life Sciences; Pharmaceuticals; Medicinal Chemicals and Botanical Products; Pharmaceutical Products; Pharmaceuticals",2.67,3.61,2.32,3.31,2.68,"6,198.99",10.63,10.09,10.37,10.90,11.66,10.63,55.20,43.83,40.40,35.16,NA,10.16,7.66,(24.61),7.87,4.85,(38.37),4.94,8.38,69.64,9.17,5.65,(38.39),5.81,6.55,12.74,,,,2.67,-24.61,,55.20,-24.61
Topsports International Holdings Limited (SEHK:6110),15403780,SEHK,Consumer Discretionary; Consumer Discretionary Distribution and Retail; Specialty Retail; Online Apparel and Accessory Retail; Apparel Retail,1.39,1.83,3.80,3.53,3.68,"32,184.34",17.99,76.78,36.88,27.36,24.12,17.99,NA,32.30,42.53,63.37,67.53,NA,9.42,#VALUE!,9.10,11.60,27.47,12.06,7.89,(34.58),7.71,6.19,(19.71),6.36,6.08,(4.40),,,,1.39,#VALUE!,,NA,#VALUE!
Towngas Smart Energy Company Limited (SEHK:1083),5001473,SEHK,Utilities; Utilities; Gas Utilities; Gas Utilities; Oil and Gas Distribution,2.78,4.29,2.21,3.83,4.62,"10,045.88",7.38,7.95,7.67,6.39,4.90,7.38,5.73,5.02,5.47,12.68,NA,5.65,5.40,(4.42),5.44,3.50,(35.66),3.45,6.78,96.52,6.93,3.92,(43.43),3.89,3.25,(16.45),,,,2.78,-4.42,,5.73,-4.42
TravelSky Technology Limited (SEHK:696),4967716,SEHK,"Consumer Discretionary; Consumer Services; Hotels, Restaurants and Leisure; Hotels, Resorts and Cruise Lines; Travel and Tourism Services; Travel Agencies",1.61,1.69,0.15,0.39,0.43,"26,365.15",7.10,14.10,2.17,3.22,3.49,7.10,34.29,231.85,10.68,26.13,NA,19.98,19.02,(4.80),19.08,18.70,(1.99),19.26,13.12,(31.88),13.14,16.50,25.57,17.26,13.50,(21.78),,,,1.61,-4.80,,34.29,-4.80
Tsim Sha Tsui Properties Limited (SEHK:247),4213727,SEHK,Real Estate Management and Development; Real Estate Development; Real Estate Management and Development; Real Estate,2.18,2.25,2.32,2.62,3.19,"37,467.17",3.66,4.91,1.15,6.95,3.78,3.66,0.17,0.64,0.11,0.17,0.21,25.50,25.20,(1.18),25.20,24.45,(2.98),24.00,23.70,(1.25),23.60,21.78,(7.71),21.75,18.20,(16.32),,,,2.18,-1.18,,0.17,-1.18
Tsingtao Brewery Company Limited (SEHK:168),4913406,SEHK,"Consumer Staples; Food, Beverage and Tobacco; Beverages; Brewers; Beer, Ale and Malt Beverages",1.03,0.73,1.23,1.67,2.73,"92,178.73",15.95,10.00,11.27,14.42,15.20,15.95,35.43,33.83,33.07,40.73,58.06,30.90,52.35,69.42,52.00,81.20,56.15,85.05,73.00,(14.17),70.85,77.10,8.82,78.10,52.40,(32.91),,,,1.03,69.42,,35.43,69.42
Uni-President China Holdings Ltd (SEHK:220),4912241,SEHK,"Consumer Staples; Food, Beverage and Tobacco; Food Products; Packaged Foods and Meats; Coffee And Tea; Tea; Dairy Products and Eggs; Dairy Products; Prepared and Preserved Foods; Seasonings and Preservatives; Coffee",3.35,4.38,6.00,6.27,6.77,"24,879.36",12.55,10.18,11.82,10.85,9.07,12.55,76.62,84.21,108.10,147.88,NA,6.75,8.18,21.19,8.26,7.89,(4.48),7.85,7.56,(3.69),7.55,7.81,3.44,7.92,5.55,(29.92),,,,3.35,21.19,,76.62,21.19
Vitasoy International Holdings Limited (SEHK:345),4912945,SEHK,"Consumer Staples; Food, Beverage and Tobacco; Food Products; Packaged Foods and Meats; Dairy Products; Coffee And Tea; Tea; Dairy Products and Eggs",1.48,1.07,1.84,0.08,0.36,"5,725.43",0.63,22.53,16.54,15.99,(4.29),0.63,53.68,82.94,62.48,NM,30.39,29.00,28.25,(2.59),28.10,30.20,7.47,31.45,15.74,(49.95),16.06,16.06,0.00,16.16,7.78,(51.86),,,,1.48,-2.59,,53.68,-2.59
VSTECS Holdings Limited (SEHK:856),4968208,SEHK,"Information Technology; Technology Hardware and Equipment; Electronic Equipment, Instruments and Components; Technology Distributors; Communications Equipment Distribution; Software Distribution; Technology Hardware and Equipment Distribution",3.80,2.63,3.01,6.00,3.86,"6,767.75",11.61,15.14,17.11,17.83,10.57,11.61,27.27,22.71,24.36,47.74,NA,3.82,4.00,4.71,3.98,6.36,59.80,6.85,7.31,6.72,7.10,4.50,(36.62),4.58,4.40,(3.93),,,,3.80,4.71,,27.27,4.71
Vtech Holdings Limited (SEHK:303),4966019,SEHK,Information Technology; Technology Hardware and Equipment; Communications Equipment; Communications Equipment; Telephone and Telecommunications Equipment; Telephone Equipment; Teleconferencing Equipment; Wireline Telephone Equipment; Cordless Telephones,6.80,6.83,11.59,10.59,9.78,"10,987.29",22.72,27.33,31.56,34.65,24.50,22.72,117.51,88.46,57.86,133.00,115.15,64.50,77.00,19.38,76.65,60.15,(21.53),61.20,61.05,(0.25),61.65,50.30,(18.41),51.00,47.15,(7.55),,,,6.80,19.38,,117.51,19.38
"Weichai Power Co., Ltd. (SEHK:2338)",4996039,SEHK,Industrials; Capital Goods; Machinery; Construction Machinery and Heavy Transportation Equipment; Heavy Duty Trucks; Industrial Trucks and Trailers,2.95,2.10,3.29,3.12,3.21,"164,028.96",10.34,18.04,15.01,13.09,5.42,10.34,44.69,32.56,53.30,89.59,52.73,8.73,16.44,88.32,17.30,15.56,(10.06),16.18,15.26,(5.69),15.62,10.48,(32.91),10.74,13.04,21.42,,,,2.95,88.32,,44.69,88.32
WH Group Limited (SEHK:288),4913418,SEHK,"Consumer Staples; Food, Beverage and Tobacco; Food Products; Packaged Foods and Meats; Prepared and Preserved Foods; Frozen Foods; Meats, Meat Processing And Meat Related Products; Livestock And Animal Specialties; Meat Processing; Meat Slaughtering; Meat Products; Poultry And Poultry Products; Poultry Processing; Poultry Slaughtering",2.48,4.85,3.58,4.19,5.95,"75,803.53",8.20,18.97,10.69,12.56,16.42,8.20,25.60,72.34,31.09,22.70,NA,5.79,8.05,39.03,8.26,6.50,(21.31),6.72,4.89,(27.23),4.93,4.54,(7.91),4.66,5.04,8.15,,,,2.48,39.03,,25.60,39.03
Wharf Real Estate Investment Company Limited (SEHK:1997),7529237,SEHK,Real Estate; Real Estate Management and Development; Real Estate Operating Companies; Real Estate Management and Development; Real Estate Operators And Lessors; Nonresidential Building Operators and Lessors; Office Building Operators and Lessors; Shopping Mall Operators and Lessors,4.52,4.24,3.43,2.95,4.85,"68,922.36",2.38,1.79,(3.78),2.11,(4.41),2.38,157.36,NM,90.34,NM,81.53,45.90,47.55,3.59,46.90,40.35,(13.97),41.05,39.60,(3.53),38.90,45.50,16.97,46.45,26.40,(43.16),,,,4.52,3.59,,157.36,3.59
"Xinhua Winshare Publishing and Media Co., Ltd. (SEHK:811)",4331835,SEHK,Media and Entertainment; Media; Publishing; Printed Media Publishing; Book Publishing; Newspaper and Magazine Publishing; Newspaper Publishing; Periodical Publishing; Published Electronic Materials; Communication Services,5.87,6.86,6.32,7.05,5.54,"16,112.27",12.49,12.83,12.98,12.33,11.71,12.49,32.50,29.31,29.29,28.27,26.61,4.85,5.86,20.82,5.90,4.78,(18.98),4.79,5.91,23.38,5.86,5.27,(10.07),5.32,6.95,30.64,,,,5.87,20.82,,32.50,20.82
Xinyi Energy Holdings Limited (SEHK:3868),6317710,SEHK,Utilities; Utilities; Independent Power and Renewable Electricity Producers; Renewable Electricity; Electric Power By Solar Energy,2.45,2.76,3.72,6.83,7.55,"8,586.85",7.94,10.75,8.31,10.05,8.01,7.94,73.35,106.19,91.74,88.25,NA,NA,2.04,#VALUE!,2.13,5.26,146.95,5.46,4.27,(21.79),4.35,2.59,(40.46),2.66,1.43,(46.24),,,,2.45,#VALUE!,,73.35,#VALUE!
Xinyi Glass Holdings Limited (SEHK:868),4911707,SEHK,Industrials; Capital Goods; Building Products; Building Products,5.04,2.17,6.56,7.98,5.48,"33,923.03",15.83,22.62,26.30,36.92,15.40,15.83,46.54,29.46,44.83,71.25,NA,8.52,10.32,21.13,10.34,21.65,109.38,22.40,19.50,(12.95),19.34,14.54,(24.82),14.92,8.76,(41.29),,,,5.04,21.13,,46.54,21.13
Xinyi Solar Holdings Limited (SEHK:968),4972454,SEHK,Information Technology; Semiconductors and Semiconductor Equipment; Semiconductors and Semiconductor Equipment; Semiconductor Materials and Equipment,1.75,0.84,2.57,2.31,3.84,"49,895.38",12.86,18.27,19.86,16.43,12.22,12.86,26.47,9.73,41.19,46.57,NA,2.69,5.53,105.58,5.74,20.25,252.79,20.65,13.22,(35.98),13.20,8.64,(34.55),8.91,4.56,(48.82),,,,1.75,105.58,,26.47,105.58
Xtep International Holdings Limited (SEHK:1368),4912870,SEHK,"Consumer Discretionary; Consumer Durables and Apparel; Textiles, Apparel and Luxury Goods; Footwear; Athletic Footwear",5.31,3.62,1.46,3.05,4.72,"11,008.03",11.99,11.90,7.08,11.64,11.20,11.99,59.98,54.40,39.24,59.71,45.51,4.31,4.14,(3.94),4.13,3.87,(6.30),3.84,13.00,238.54,12.96,8.69,(32.95),8.70,4.41,(49.31),,,,5.31,-3.94,,59.98,-3.94
Yangtze Optical Fibre And Cable Joint Stock Limited Company (SEHK:6869),4967958,SEHK,Information Technology; Technology Hardware and Equipment; Communications Equipment; Communications Equipment; Networking Equipment; Optical Networking Equipment,3.66,3.36,2.02,2.37,6.00,"14,607.12",8.14,9.06,5.94,7.22,9.25,8.14,32.15,51.31,35.85,31.69,44.44,20.75,15.48,(25.40),15.98,10.36,(35.17),10.52,12.94,23.00,13.28,13.90,4.67,13.94,8.36,(40.03),,,,3.66,-25.40,,32.15,-25.40
Yankuang Energy Group Company Limited (SEHK:1171),4157535,SEHK,"Energy; Energy; Oil, Gas and Consumable Fuels; Coal and Consumable Fuels; Coal Products",8.78,10.23,4.69,7.88,14.99,"175,659.60",20.37,13.51,7.14,20.86,37.91,20.37,63.47,118.68,65.82,56.30,127.37,4.06,4.67,14.94,4.74,4.13,(12.80),4.14,10.33,149.60,10.84,15.87,46.37,15.87,14.84,(6.47),,,,8.78,14.94,,63.47,14.94
