Guangdong Investment Limited (SEHK:270),5000876,SEHK,Utilities; Utilities; Water Utilities; Water Utilities; Sewage Treatment Systems; Water Supply,3.36,4.16,6.00,7.67,10.80,"23,405.40",4.83,11.28,10.57,9.31,9.18,4.83,71.02,84.28,82.78,84.06,NA,14.94,16.30,9.10,16.38,13.96,(14.77),14.20,9.91,(30.21),9.90,7.99,(19.29),8.24,5.68,(31.07),,,,3.36,9.10,,71.02,9.10
"Guangzhou Automobile Group Co., Ltd. (SEHK:2238)",4911721,SEHK,Consumer Discretionary; Automobiles and Components; Automobile Manufacturers; Automobiles; Passenger Motor Vehicles,3.86,2.29,3.12,5.06,7.09,"76,364.02",3.03,8.37,7.16,8.25,7.44,3.03,60.34,41.55,37.82,41.05,79.08,7.71,9.70,25.81,9.84,8.62,(12.40),8.67,7.69,(11.30),7.83,5.26,(32.82),5.33,3.63,(31.89),,,,3.86,25.81,,60.34,25.81
Guangzhou Baiyunshan Pharmaceutical Holdings Company Limited (SEHK:874),4810945,SEHK,Health Care; Health Care Equipment and Services; Health Care Providers and Services; Health Care Distributors; Pharmaceutical Product Distribution; Healthcare Equipment Distribution,1.81,3.39,2.92,3.50,3.74,"49,838.76",12.12,14.01,11.41,13.33,13.09,12.12,32.79,44.25,34.04,37.58,39.09,27.15,26.60,(2.03),26.75,19.02,(28.90),18.82,22.45,19.29,23.80,23.00,(3.36),23.10,21.75,(5.84),,,,1.81,-2.03,,32.79,-2.03
"Guangzhou Rural Commercial Bank Co., Ltd. (SEHK:1551)",4308417,SEHK,Financials; Banks; Banks; Regional Banks; Regional Commercial Banks,6.23,6.24,7.08,4.64,5.23,"23,055.66",3.53,12.24,7.06,4.64,4.61,3.53,26.09,45.58,38.07,40.13,23.08,4.99,3.65,(26.85),3.64,3.50,(3.85),3.50,3.43,(2.00),3.20,2.64,(17.50),2.63,2.20,(16.35),,,,6.23,-26.85,,26.09,-26.85
Guoco Group Limited (SEHK:53),4085474,SEHK,Industrials; Capital Goods; Industrial Conglomerates; Industrial Conglomerates,3.03,2.71,2.35,3.01,5.33,"23,165.22",4.81,5.19,(0.97),3.28,4.31,4.81,38.47,NM,26.04,33.35,19.11,98.00,132.00,34.69,132.00,92.25,(30.11),94.90,85.00,(10.43),84.55,66.50,(21.35),66.70,56.30,(15.59),,,,3.03,34.69,,38.47,34.69
"Haitong Unitrust International Financial Leasing Co., Ltd. (SEHK:1905)",4558801,SEHK,Financials; Financial Services; Business Credit Agencies; Finance Leasing; Financial Services; Specialized Finance; Credit Agencies,3.32,6.50,7.51,9.38,14.42,"7,411.77",8.23,9.61,7.17,8.44,8.41,8.23,35.08,65.04,41.32,44.19,60.93,NA,1.68,#VALUE!,1.60,1.42,(11.25),1.41,1.03,(26.95),0.96,0.85,(11.46),0.77,0.82,6.49,,,,3.32,#VALUE!,,35.08,#VALUE!
Hang Lung Group Limited (SEHK:10),4260129,SEHK,Real Estate; Real Estate Management and Development; Real Estate Operating Companies; Real Estate Management Services; Real Estate Operators And Lessors; Nonresidential Building Operators and Lessors; Office Building Operators and Lessors; Shopping Mall Operators and Lessors; Residential Building Operators and Lessors; Apartment Building Operators and Lessors; Real Estate Management and Development,4.15,4.25,5.04,6.00,8.08,"11,955.01",3.17,8.14,(1.38),3.13,3.00,3.17,21.56,NM,45.26,43.00,41.75,19.52,19.26,(1.33),19.50,19.28,(1.13),18.96,16.66,(12.13),16.36,14.34,(12.35),14.52,10.64,(26.72),,,,4.15,-1.33,,21.56,-1.33
Hang Lung Properties Limited (SEHK:101),4143410,SEHK,Real Estate; Real Estate Management and Development; Real Estate Management Services; Nonresidential Property Managers; Residential Property Managers; Real Estate Operators And Lessors; Nonresidential Building Operators and Lessors; Office Building Operators and Lessors; Shopping Mall Operators and Lessors; Residential Building Operators and Lessors; Real Estate Management and Development; Real Estate Operating Companies; Hotel Property Operators and Lessors; Industrial Property Operators and Lessors; Apartment Building Operators and Lessors,4.39,3.72,4.80,5.11,7.17,"36,129.06",3.22,6.73,(1.39),3.20,2.98,3.22,55.47,NM,90.70,91.76,88.64,14.58,17.10,17.28,17.28,20.45,18.34,20.20,16.04,(20.59),15.78,15.26,(3.30),15.76,10.88,(30.96),,,,4.39,17.28,,55.47,17.28
Hang Seng Bank Limited (SEHK:11),4147673,SEHK,Financials; Banks; Banks; Diversified Banks,4.84,5.01,4.27,3.00,5.82,"181,822.97",10.87,14.56,9.21,7.59,6.55,10.87,64.20,65.77,73.55,74.12,72.50,173.00,161.00,(6.94),162.20,133.70,(17.57),137.00,142.70,4.16,144.30,129.80,(10.05),129.90,91.05,(29.91),,,,4.84,-6.94,,64.20,-6.94
Health and Happiness (H&H) International Holdings Limited (SEHK:1112),4911673,SEHK,"Food, Beverage and Tobacco; Consumer Staples; Food Products; Packaged Foods and Meats; Meats, Meat Processing And Meat Related Products; Meat Products; Prepared and Preserved Foods; Animal Feed; Confectionery Products; Candy; Infant Food",1.49,3.68,6.29,2.52,6.78,"6,281.31",9.36,19.25,19.27,8.41,10.17,9.36,27.02,75.84,80.14,38.19,81.56,42.30,32.25,(23.76),33.75,28.70,(14.96),29.65,12.08,(59.26),11.78,16.66,41.43,16.42,12.10,(26.31),,,,1.49,-23.76,,27.02,-23.76
Henderson Land Development Company Limited (SEHK:12),4143422,SEHK,Real Estate; Real Estate Management and Development; Real Estate Development; Real Estate Management and Development,4.39,5.95,1.51,6.61,7.48,"112,320.18",2.84,5.30,3.13,3.90,2.73,2.84,51.28,85.31,NA,NA,94.24,34.77,38.25,10.00,38.25,30.25,(20.92),30.90,33.20,7.44,33.25,27.25,(18.05),27.60,24.05,(12.86),,,,4.39,10.00,,51.28,10.00
Hengan International Group Company Limited (SEHK:1044),4912578,SEHK,Consumer Staples; Household and Personal Products; Personal Care Products; Personal Care Products; Beauty Care Products; Skin Care Products; Baby Care Products; Diapers; Feminine Care Products,4.54,4.94,6.87,4.03,5.37,"28,297.64",13.90,22.29,24.38,16.90,9.98,13.90,66.98,63.44,82.66,84.51,NA,57.00,55.50,(2.63),55.10,54.90,(0.36),56.00,40.15,(28.30),40.40,41.45,2.60,40.70,29.05,(28.62),,,,4.54,-2.63,,66.98,-2.63
HK Electric Investments and HK Electric Investments Limited (SEHK:2638),5001177,SEHK,Utilities; Utilities; Electric Utilities; Electric Utilities; Electric Power Distribution; Electric Power Generation By Fossil Fuels; Electric Power Transmission and Control,4.70,4.20,4.19,6.20,6.80,"40,204.71",6.42,4.79,5.68,6.10,6.05,6.42,136.91,103.59,96.49,95.80,NA,7.93,7.68,(3.15),7.76,7.63,(1.68),7.68,7.65,(0.39),7.72,5.17,(33.03),5.25,4.71,(10.29),,,,4.70,-3.15,,136.91,-3.15
HKT Trust and HKT Limited (SEHK:6823),4999372,SEHK,Communication Services; Telecommunication Services; Integrated Telecommunication Services; Local Telecommunications Services; Long Distance Telecommunications Services; Diversified Telecommunication Services,6.30,7.00,6.84,7.67,8.07,"66,925.27",13.96,13.86,14.02,12.84,13.36,13.96,100.40,100.62,112.90,113.47,114.12,11.38,10.98,(3.51),11.00,10.06,(8.55),10.02,10.48,4.59,10.54,9.57,(9.20),9.76,9.32,(4.51),,,,6.30,-3.51,,100.40,-3.51
Hong Kong Exchanges and Clearing Limited (SEHK:388),4322619,SEHK,Financials; Financial Services; Capital Markets; Financial Exchanges and Data; Security and Commodity Exchanges,2.68,1.58,2.01,2.26,3.06,"275,165.03",23.52,21.99,24.51,25.21,20.19,23.52,61.60,60.70,91.96,95.90,86.97,222.00,253.00,13.96,260.40,425.00,63.21,441.80,455.40,3.08,454.60,337.20,(25.82),343.00,268.00,(21.87),,,,2.68,13.96,,61.60,13.96
Huadian Power International Corporation Limited (SEHK:1071),4351103,SEHK,Utilities; Utilities; Independent Power and Renewable Electricity Producers; Independent Power Producers and Energy Traders,2.49,8.21,9.03,9.07,6.39,"74,236.36",6.25,6.08,7.09,(7.97),(0.86),6.25,203.26,164.78,NM,NM,146.88,3.45,2.96,(14.20),2.95,1.95,(33.90),2.07,3.40,64.25,3.60,3.23,(10.28),3.34,3.47,3.89,,,,2.49,-14.20,,203.26,-14.20
Industrial and Commercial Bank of China Limited (SEHK:1398),4226356,SEHK,Financials; Banks; Banks; Diversified Banks; Diversified Commercial Banks,4.75,5.71,7.27,8.54,8.62,"1,942,944.36",10.02,12.44,11.34,11.33,10.64,10.02,30.48,31.27,29.29,29.66,31.29,5.43,6.00,10.50,6.05,5.03,(16.86),4.85,4.40,(9.28),4.42,4.02,(9.05),4.06,3.82,(5.91),,,,4.75,10.50,,30.48,10.50
Jiangsu Expressway Company Limited (SEHK:177),4995084,SEHK,Industrials; Transportation; Highways and Railtracks; Transportation Infrastructure,4.89,5.80,6.98,7.53,7.18,"59,301.64",11.69,13.86,7.66,12.10,9.92,11.69,64.87,123.90,73.90,91.36,77.19,10.90,10.68,(2.02),10.86,8.67,(20.17),8.73,7.99,(8.48),8.04,7.13,(11.32),7.14,7.02,(1.68),,,,4.89,-2.02,,64.87,-2.02
Jiangxi Copper Company Limited (SEHK:358),4351423,SEHK,Materials; Materials; Metals and Mining; Copper; Copper Ores; Primary Smelting And Refining Of Copper; Secondary Smelting And Refining Of Copper,2.12,0.89,0.98,5.10,5.01,"78,265.53",8.79,3.92,3.88,8.18,7.62,8.79,117.51,91.92,26.70,41.17,54.84,9.07,10.72,18.19,10.88,12.18,11.95,12.94,12.48,(3.55),12.70,11.52,(9.29),11.80,11.04,(6.44),,,,2.12,18.19,,117.51,18.19
JNBY Design Limited (SEHK:3306),4912661,SEHK,"Consumer Discretionary; Consumer Durables and Apparel; Textiles, Apparel and Luxury Goods; Apparel, Accessories and Luxury Goods; Accessories; Apparel; Infant's Apparel; Men's Apparel; Women's, Misses', and Juniors' Apparel",7.65,6.00,12.10,10.29,9.24,"7,272.67",33.89,35.92,23.94,40.42,32.86,33.89,70.53,63.40,61.16,80.63,63.07,10.28,10.46,1.75,10.50,9.00,(14.29),8.80,12.40,40.91,12.22,9.33,(23.65),9.21,10.50,14.01,,,,7.65,1.75,,70.53,1.75
Johnson Electric Holdings Limited (SEHK:179),4990896,SEHK,Consumer Discretionary; Automobile Components; Automotive Parts and Equipment; Automobiles and Components,2.88,1.77,3.09,3.46,4.11,"9,180.96",6.45,11.77,(21.83),10.41,6.33,6.45,15.40,NM,8.03,37.03,7.87,15.80,17.72,12.15,17.66,19.20,8.72,19.96,16.52,(17.23),16.70,9.83,(41.14),10.06,12.40,23.26,,,,2.88,12.15,,15.40,12.15
K. Wah International Holdings Limited (SEHK:173),4429476,SEHK,"Real Estate; Real Estate Management and Development; Real Estate Development; Land Sub Dividers And Developers; Land Sub Dividers and Developers, except Cemetery; Real Estate Management and Development",4.60,5.63,6.98,7.75,10.77,"5,357.25",1.84,8.39,7.76,7.64,3.11,1.84,19.87,20.10,19.60,47.93,62.50,3.71,4.35,17.25,4.35,3.73,(14.25),3.68,3.01,(18.21),3.01,2.71,(9.97),2.78,1.95,(29.86),,,,4.60,17.25,,19.87,17.25
Kerry Logistics Network Limited (SEHK:636),4995112,SEHK,Industrials; Transportation; Air Freight and Logistics; Air Freight and Logistics,3.29,1.71,2.36,5.56,5.72,"14,947.44",6.98,17.10,5.06,14.88,16.58,6.98,11.30,17.96,10.21,39.39,NA,11.58,13.38,15.54,13.62,17.00,24.82,17.42,19.06,9.41,19.52,14.04,(28.07),14.00,8.22,(41.29),,,,3.29,15.54,,11.30,15.54
Kerry Properties Limited (SEHK:683),4143419,SEHK,Real Estate; Real Estate Management and Development; Diversified Real Estate Activities; Real Estate Management and Development,5.45,6.87,6.65,7.94,9.45,"20,173.15",3.42,6.80,4.94,8.79,2.73,3.42,28.48,98.38,51.34,71.05,60.54,26.55,24.75,(6.78),25.05,19.64,(21.60),19.72,20.30,2.94,20.55,17.00,(17.27),17.62,14.28,(18.96),,,,5.45,-6.78,,28.48,-6.78
Kinetic Development Group Limited (SEHK:1277),4379718,SEHK,"Energy; Energy; Oil, Gas and Consumable Fuels; Coal and Consumable Fuels; Coal Products",12.00,10.23,18.27,20.83,18.18,"8,008.50",30.18,41.31,32.47,67.31,48.79,30.18,40.22,41.65,26.80,33.75,37.31,0.46,0.38,(18.48),0.38,0.44,17.33,0.43,0.52,20.93,0.51,0.60,17.65,0.59,0.55,(6.78),,,,12.00,-18.48,,40.22,-18.48
Kingboard Holdings Limited (SEHK:148),4571283,SEHK,"Information Technology; Technology Hardware and Equipment; Electronic Equipment, Instruments and Components; Electronic Components; Electronic Components; Microelectronics",3.97,2.69,4.11,11.03,4.87,"15,782.36",3.63,6.69,9.82,19.39,6.28,3.63,34.30,14.09,13.15,91.00,NA,20.85,24.70,18.47,25.15,32.70,30.02,33.15,37.95,14.48,38.45,24.85,(35.37),25.45,18.68,(26.60),,,,3.97,18.47,,34.30,18.47
Kingboard Laminates Holdings Limited (SEHK:1888),4970845,SEHK,"Technology Hardware and Equipment; Information Technology; Electronic Equipment, Instruments and Components; Electronic Components",4.66,3.16,4.90,15.73,3.87,"17,253.60",6.05,13.17,16.95,40.56,11.19,6.05,57.72,32.98,115.02,245.13,NA,6.36,9.66,51.89,9.78,12.66,29.45,12.70,13.26,4.41,13.40,8.58,(35.97),8.64,6.72,(22.22),,,,4.66,51.89,,57.72,51.89
Kowloon Development Company Limited (SEHK:34),4143413,SEHK,Real Estate; Real Estate Management and Development; Real Estate Development; Real Estate Management and Development,7.57,9.63,7.86,11.23,14.04,"5,730.19",1.80,6.44,2.46,12.06,6.43,1.80,37.50,117.65,43.62,80.58,NA,8.28,9.77,18.00,9.80,8.10,(17.35),8.25,10.30,24.85,10.36,7.39,(28.67),7.47,5.91,(20.88),,,,7.57,18.00,,37.50,18.00
Kunlun Energy Company Limited (SEHK:135),4424748,SEHK,Utilities; Utilities; Gas Utilities; Gas Utilities; Oil and Gas Distribution,3.74,4.22,3.53,4.53,4.08,"61,304.32",11.12,6.18,7.08,9.82,10.48,11.12,32.98,37.56,7.90,34.41,NA,8.06,6.88,(14.64),7.04,6.70,(4.83),7.00,7.31,4.43,7.41,5.57,(24.83),5.64,7.04,24.82,,,,3.74,-14.64,,32.98,-14.64
Lee & Man Paper Manufacturing Limited (SEHK:2314),4984427,SEHK,Materials; Materials; Paper and Forest Products; Paper Products; Industrial Service Paper; Tissue Paper; Paper Manufacturing; Pulp Mills,4.75,3.94,6.09,5.09,2.53,"9,836.29",4.02,13.41,12.85,10.14,4.25,4.02,39.10,33.28,48.07,67.35,NA,6.62,5.90,(10.88),6.05,6.35,4.96,6.30,5.42,(13.97),5.44,3.44,(36.76),3.48,2.29,(34.20),,,,4.75,-10.88,,39.10,-10.88
Legend Holdings Corporation (SEHK:3396),4411094,SEHK,"Information Technology; Technology Hardware and Equipment; Technology Hardware, Storage and Peripherals; Technology Hardware, Storage and Peripherals",1.87,3.55,3.79,5.61,2.95,"12,464.46",0.62,9.87,10.11,17.88,10.66,0.62,5.32,18.54,14.76,71.63,NM,20.00,17.68,(11.60),17.76,10.18,(42.68),10.18,11.52,13.16,11.52,8.35,(27.52),8.62,7.36,(14.62),,,,1.87,-11.60,,5.32,-11.60
Lenovo Group Limited (SEHK:992),4329903,SEHK,"Information Technology; Technology Hardware, Storage and Peripherals; Technology Hardware and Equipment; Technology Hardware, Storage and Peripherals; Computer Components; Personal Computers And Accessories; Computer Audio Equipment; Desktop Computers; Laptop Computers; Monitors; Servers; Wireless Telephone Equipment; Mobile Telephones",5.37,3.84,3.57,5.93,3.48,"102,090.35",29.38,15.21,19.73,34.24,47.65,29.38,62.20,59.98,35.86,23.59,36.00,5.13,5.23,1.95,5.37,7.32,36.31,7.62,8.96,17.59,9.05,6.41,(29.17),6.49,10.92,68.26,,,,5.37,1.95,,62.20,1.95
Li Ning Company Limited (SEHK:2331),4913188,SEHK,"Consumer Discretionary; Consumer Durables and Apparel; Textiles, Apparel and Luxury Goods; Apparel, Accessories and Luxury Goods; Apparel; Accessories; Specialty Apparel; Athletic Uniforms",0.42,0.32,0.29,0.79,4.32,"45,003.98",13.08,23.16,21.48,26.93,17.89,13.08,14.32,22.24,12.84,29.40,NA,8.39,23.35,178.31,23.05,53.30,131.24,53.30,85.35,60.13,85.50,67.75,(20.76),69.35,20.90,(69.86),,,,0.42,178.31,,14.32,178.31
"Liaoning Port Co., Ltd. (SEHK:2880)",4562018,SEHK,Industrials; Transportation; Transportation Infrastructure; Marine Ports and Services; Marine Cargo Services; Towing and Tugboat Services,2.23,3.11,5.13,4.65,3.08,"31,973.31",3.56,4.24,7.21,5.10,3.55,3.56,116.27,61.52,66.92,75.67,62.98,0.99,0.97,(2.02),0.98,0.74,(24.49),0.76,0.71,(6.58),0.71,0.68,(4.23),0.69,0.62,(10.14),,,,2.23,-2.02,,116.27,-2.02
Link Real Estate Investment Trust (SEHK:823),4143456,SEHK,Real Estate; Equity Real Estate Investment Trusts (REITs); Retail REITs; Retail REITs,3.42,4.07,4.49,5.26,5.68,"79,807.66",8.69,11.10,(9.90),0.47,4.29,8.69,28.37,NM,508.75,NA,NA,78.20,82.50,5.50,82.30,70.60,(14.22),71.75,68.65,(4.32),68.65,57.30,(16.53),58.20,43.85,(24.66),,,,3.42,5.50,,28.37,5.50
L'Occitane International S.A. (SEHK:973),4911163,SEHK,Consumer Staples; Household and Personal Products; Personal Care Products; Personal Care Products; Beauty Care Products; Cosmetics; Hair Care Products; Perfumes and Colognes; Skin Care Products,1.37,1.04,1.05,2.25,1.14,"43,478.36",9.45,11.55,10.14,12.56,18.71,9.45,36.72,37.24,21.58,22.37,84.13,14.50,18.46,27.31,18.02,19.32,7.21,19.16,31.55,64.67,32.55,24.35,(25.19),24.60,22.30,(9.35),,,,1.37,27.31,,36.72,27.31
Longfor Group Holdings Limited (SEHK:960),4429478,SEHK,Real Estate; Real Estate Management and Development; Real Estate Development; Real Estate Management and Development,3.26,3.07,4.97,7.39,9.83,"62,394.38",7.30,17.27,16.05,15.33,14.43,7.30,39.00,44.07,41.23,26.82,27.06,22.40,36.50,62.95,37.10,45.40,22.37,44.25,36.70,(17.06),36.10,24.30,(32.69),24.15,12.50,(48.24),,,,3.26,62.95,,39.00,62.95
Lonking Holdings Limited (SEHK:3339),4988980,SEHK,Industrials; Capital Goods; Machinery; Construction Machinery and Heavy Transportation Equipment; Construction Machinery and Equipment,8.55,10.42,15.07,16.06,8.20,"6,291.75",6.54,19.02,20.45,12.57,4.01,6.54,44.49,49.79,93.06,191.14,NA,1.98,2.34,18.18,2.43,2.40,(1.23),2.40,2.19,(8.75),2.19,1.37,(37.44),1.40,1.22,(12.86),,,,8.55,18.18,,44.49,18.18
Luk Fook Holdings (International) Limited (SEHK:590),4914648,SEHK,Consumer Discretionary; Consumer Discretionary Distribution and Retail; Specialty Retail; Other Specialty Retail,4.90,3.88,5.00,4.74,6.06,"10,579.68",10.57,14.57,8.27,9.38,11.90,10.57,43.26,74.55,41.84,44.28,50.27,22.10,22.45,1.58,22.75,18.70,(17.80),18.40,21.00,14.13,21.25,23.20,9.18,24.05,20.95,(12.89),,,,4.90,1.58,,43.26,1.58
Man Wah Holdings Limited (SEHK:1999),4916289,SEHK,Consumer Discretionary; Consumer Durables and Apparel; Household Durables; Home Furnishings; Mattresses and Beds; Metal Household Furniture; Wood Household Furniture,2.34,1.31,2.40,4.12,4.67,"19,969.32",14.70,21.35,24.26,21.71,19.18,14.70,50.55,30.31,43.46,51.05,65.57,3.00,5.55,85.00,5.52,16.82,204.71,17.10,12.08,(29.36),11.54,7.77,(32.67),7.83,5.35,(31.67),,,,2.34,85.00,,50.55,85.00
Metallurgical Corporation of China Ltd. (SEHK:1618),4352229,SEHK,Industrials; Capital Goods; Construction and Engineering; Construction and Engineering; Construction Support Services; Engineering and Surveying Services; Engineering Services; Nonbuilding Structures Construction; Heavy Construction; Specialty Contract Work,4.55,5.75,4.53,5.28,5.98,"69,376.86",6.92,6.90,7.29,7.96,8.26,6.92,128.76,91.68,78.26,62.82,73.72,1.88,1.75,(6.91),1.79,1.37,(23.46),1.41,1.99,41.13,2.05,1.73,(15.61),1.75,1.52,(13.14),,,,4.55,-6.91,,128.76,-6.91
Midea Real Estate Holding Limited (SEHK:3990),10735009,SEHK,"Real Estate; Real Estate Management and Development; Real Estate Development; Land Sub Dividers and Developers, except Cemetery; Real Estate Management and Development; Land Sub Dividers And Developers",5.13,9.24,13.20,13.29,14.90,"5,138.77",4.23,15.81,13.53,12.05,7.29,4.23,40.58,38.18,42.80,52.23,50.39,16.16,23.90,47.90,24.55,17.32,(29.45),16.80,12.12,(27.86),11.84,12.04,1.69,12.12,5.37,(55.69),,,,5.13,47.90,,40.58,47.90
Minth Group Limited (SEHK:425),4914520,SEHK,Consumer Discretionary; Automobiles and Components; Automobile Components; Automotive Parts and Equipment,2.40,1.60,1.67,2.98,3.66,"14,548.16",10.66,12.53,9.74,9.91,8.94,10.66,39.48,49.76,36.76,41.02,NA,24.30,27.50,13.17,28.85,40.90,41.77,40.90,34.35,(16.01),33.45,21.15,(36.77),21.35,15.78,(26.09),,,,2.40,13.17,,39.48,13.17
"Miramar Hotel and Investment Company, Limited (SEHK:71)",4982119,SEHK,"Consumer Discretionary; Consumer Services; Hotels, Restaurants and Leisure; Hotels, Resorts and Cruise Lines; Travel and Tourism Services; Travel Agencies; Lodging; Hotels And Motels; Hotels",3.89,4.31,3.75,3.86,4.86,"6,826.68",4.99,6.82,1.54,1.68,2.43,4.99,32.72,128.17,100.52,67.64,NA,15.04,15.70,4.39,15.66,13.00,(16.99),12.90,12.80,(0.78),12.88,12.18,(5.43),12.30,10.70,(13.01),,,,3.89,4.39,,32.72,4.39
MTR Corporation Limited (SEHK:66),4259264,SEHK,Industrials; Transportation; Ground Transportation; Rail Transportation; Railroad Transportation of Passengers; Commuter Rail Systems,2.61,2.84,2.94,3.48,4.32,"150,145.31",4.51,6.58,(2.65),5.42,5.64,4.51,55.72,NM,75.01,87.13,97.57,40.50,46.05,13.70,45.90,43.35,(5.56),44.15,41.85,(5.21),42.15,41.35,(1.90),41.80,30.30,(27.51),,,,2.61,13.70,,55.72,13.70
NetDragon Websoft Holdings Limited (SEHK:777),4969307,SEHK,Media and Entertainment; Interactive Home Entertainment; Entertainment Software; Computer and Mobile Games; Communication Services; Entertainment,1.64,2.88,3.55,4.77,6.46,"5,673.88",7.00,13.84,14.25,14.32,11.17,7.00,17.32,26.75,28.44,43.40,159.46,11.96,18.32,53.18,18.90,17.38,(8.04),17.38,18.32,5.41,18.14,16.76,(7.61),16.78,12.38,(26.22),,,,1.64,53.18,,17.32,53.18
New World Development Company Limited (SEHK:17),4143428,SEHK,Real Estate; Real Estate Management and Development; Diversified Real Estate Activities; Real Estate Management and Development,4.78,5.65,6.68,9.36,6.27,"20,007.23",1.47,8.16,1.18,1.60,1.45,1.47,7.16,474.42,457.78,412.00,602.56,40.56,42.72,5.33,42.80,36.10,(15.65),36.80,30.85,(16.17),30.45,22.00,(27.75),22.75,12.12,(46.73),,,,4.78,5.33,,7.16,5.33
Nexteer Automotive Group Limited (SEHK:1316),4631322,SEHK,Consumer Discretionary; Automobiles and Components; Automobile Components; Automotive Parts and Equipment; Motor Vehicle Safety and Security Systems; Steering and Suspension System Components,3.43,3.01,0.75,1.45,0.74,"9,813.41",2.27,13.18,6.48,6.44,3.29,2.27,33.44,69.79,19.91,41.10,NA,10.90,7.06,(35.23),7.06,8.33,17.99,8.82,9.68,9.75,9.68,5.11,(47.21),5.25,4.93,(6.10),,,,3.43,-35.23,,33.44,-35.23
Nissin Foods Company Limited (SEHK:1475),6348755,SEHK,"Consumer Staples; Food, Beverage and Tobacco; Food Products; Packaged Foods and Meats; Frozen Foods; Prepared and Preserved Foods; Snack Food; Seasonings and Preservatives; Sauces And Salad Dressings; Packaged Food Mixes",1.53,1.83,2.35,2.18,2.43,"5,176.53",9.23,7.63,8.58,8.32,9.11,9.23,40.67,41.63,49.42,48.01,NA,3.61,6.19,71.47,6.22,6.38,2.57,6.38,5.97,(6.43),6.10,6.69,9.67,6.72,6.25,(6.99),,,,1.53,71.47,,40.67,71.47
NWS Holdings Limited (SEHK:659),4995427,SEHK,Industrials; Capital Goods; Industrial Conglomerates; Industrial Conglomerates,5.31,8.07,8.07,9.04,8.29,"25,349.18",5.12,7.93,1.94,3.02,3.35,5.12,69.20,341.46,168.08,135.02,115.29,15.86,10.92,(31.15),11.10,7.19,(35.23),7.51,7.31,(2.66),7.48,6.75,(9.76),6.80,7.36,8.24,,,,5.31,-31.15,,69.20,-31.15
Orient Overseas (International) Limited (SEHK:316),4994763,SEHK,Industrials; Transportation; Marine Transportation; Marine Transportation Of Freight; Cargo or Container Ships; Marine Transportation,2.17,0.76,9.22,33.40,23.65,"62,702.44",11.11,3.19,17.09,93.10,86.25,11.11,6.66,132.81,20.23,40.03,159.32,52.20,37.80,(27.59),37.70,77.50,105.57,81.65,191.30,134.29,201.00,141.00,(29.85),141.70,109.00,(23.08),,,,2.17,-27.59,,6.66,-27.59
Pacific Basin Shipping Limited (SEHK:2343),4296133,SEHK,Industrials; Transportation; Marine Transportation; Marine Transportation; Marine Transportation Of Freight; Cargo or Container Ships,2.26,1.44,4.90,29.17,9.14,"12,422.62",5.90,2.00,(17.79),58.35,37.55,5.90,86.87,NM,10.24,102.04,144.04,1.48,1.64,10.81,1.64,1.46,(10.98),1.54,2.86,85.71,3.00,2.64,(12.00),2.62,2.57,(1.91),,,,2.26,10.81,,86.87,10.81
PAX Global Technology Limited (SEHK:327),4972219,SEHK,"Information Technology; Technology Hardware and Equipment; Electronic Equipment, Instruments and Components; Electronic Equipment and Instruments",2.19,1.89,3.99,4.74,6.61,"6,808.98",16.19,13.96,17.53,18.16,18.98,16.19,14.11,15.64,32.37,27.30,NA,2.87,3.65,27.18,3.77,6.88,82.49,7.02,5.52,(21.37),5.43,6.75,24.31,6.80,6.05,(11.03),,,,2.19,27.18,,14.11,27.18
PCCW Limited (SEHK:8),4163694,SEHK,Communication Services; Diversified Telecommunication Services; Integrated Telecommunication Services; Telecommunication Services; Local Telecommunications Services; Long Distance Telecommunications Services,6.84,6.89,8.19,10.58,9.19,"29,907.71",18.61,15.27,8.74,18.93,13.64,18.61,356.98,NM,206.64,791.86,NM,4.52,4.61,1.99,4.61,4.67,1.30,4.60,3.95,(14.13),3.97,3.52,(11.34),3.61,4.16,15.24,,,,6.84,1.99,,356.98,1.99
PetroChina Company Limited (SEHK:857),5985856,SEHK,"Energy; Energy; Oil, Gas and Consumable Fuels; Integrated Oil and Gas",3.81,6.01,7.57,9.71,9.14,"2,068,620.15",11.40,4.70,2.38,8.27,11.10,11.40,66.28,147.73,43.25,NA,NA,4.63,3.91,(15.55),3.93,2.40,(38.93),2.40,3.47,44.58,3.48,3.57,2.59,3.60,5.16,43.33,,,,3.81,-15.55,,66.28,-15.55
PICC Property and Casualty Company Limited (SEHK:2328),4141028,SEHK,Financials; Insurance; Insurance; Property and Casualty Insurance; Casualty; Accident Insurance; Fire and Marine Insurance; Liability Insurance; Property; Commercial Property Insurance; Surety Insurance; Personal Property Insurance; Homeowner's and Renter's Insurance; Motor Vehicle Insurance,3.29,8.59,7.13,6.41,5.65,"221,760.37",10.78,15.59,11.59,11.31,13.63,10.78,42.28,40.62,38.43,34.97,44.24,7.78,9.39,20.69,9.58,5.87,(38.73),5.88,6.37,8.33,6.47,7.41,14.53,7.38,9.28,25.75,,,,3.29,20.69,,42.28,20.69
"Postal Savings Bank of China Co., Ltd. (SEHK:1658)",4395358,SEHK,Banks; Banks; Diversified Banks; Diversified Commercial Banks; Financials,4.15,5.22,4.58,5.98,7.50,"488,870.89",9.70,11.97,10.56,10.42,10.53,9.70,29.19,29.89,30.20,28.81,31.44,4.15,5.30,27.71,5.35,4.38,(18.13),4.38,5.47,24.89,5.54,4.85,(12.45),4.96,3.73,(24.80),,,,4.15,27.71,,29.19,27.71
Power Assets Holdings Limited (SEHK:6),4098381,SEHK,Utilities; Utilities; Electric Utilities; Electric Utilities; Electric Power Distribution; Electric Power Generation By Fossil Fuels; Electric Power Transmission and Control,4.91,6.67,5.80,6.60,6.23,"92,170.30",6.84,8.44,7.20,7.16,6.51,6.84,83.80,97.46,98.03,106.55,NA,53.50,57.00,6.54,57.15,42.00,(26.51),42.70,48.60,13.82,49.25,42.75,(13.20),43.05,45.25,5.11,,,,4.91,6.54,,83.80,6.54
"Qingdao Port International Co., Ltd. (SEHK:6198)",4995333,SEHK,Transportation; Transportation Infrastructure; Marine Cargo Services; Industrials; Marine Ports and Services,7.87,4.57,7.29,7.95,7.03,"53,413.62",12.86,13.12,12.57,12.16,12.92,12.86,70.27,37.89,49.68,40.62,38.22,5.06,5.53,9.29,5.61,4.79,(14.62),4.84,4.32,(10.74),4.37,3.78,(13.50),3.85,4.23,9.87,,,,7.87,9.29,,70.27,9.29
"Qinhuangdao Port Co., Ltd. (SEHK:3369)",4995404,SEHK,Industrials; Transportation; Transportation Infrastructure; Marine Ports and Services; Marine Cargo Services; Towing and Tugboat Services,5.99,7.54,6.11,6.02,5.76,"18,221.06",8.32,5.42,5.68,6.04,7.73,8.32,82.69,82.05,65.08,46.86,41.44,1.76,1.46,(17.05),1.47,1.30,(11.56),1.30,1.26,(3.08),1.25,1.09,(12.80),1.12,1.34,19.64,,,,5.99,-17.05,,82.69,-17.05
